{
  "$schema": "https://json-schema.org/draft/2020-12/schema",
  "$id": "urn:sfskills:output-envelope",
  "title": "Agent Output Envelope",
  "description": "Structured JSON envelope every run-time agent emits alongside its human-readable markdown report. Build-time agents MAY use it but are not required to.",
  "type": "object",
  "additionalProperties": false,
  "required": [
    "agent",
    "mode",
    "summary",
    "confidence",
    "process_observations",
    "citations",
    "run_id",
    "report_path",
    "envelope_path"
  ],
  "properties": {
    "agent": {
      "type": "string",
      "pattern": "^[a-z0-9]+(?:-[a-z0-9]+)*$",
      "description": "The agent id (matches frontmatter.id)."
    },
    "mode": {
      "type": "string",
      "description": "One of the modes declared in the agent's frontmatter.modes."
    },
    "run_id": {
      "type": "string",
      "minLength": 8,
      "description": "Wave 10: run identifier \u2014 ISO-8601 timestamp with UTC Z suffix OR a UUID. Forms the filename stem for report_path and envelope_path. Required so every run's deliverable is uniquely addressable and prior runs are preserved."
    },
    "report_path": {
      "type": "string",
      "pattern": "^(docs/reports/[a-z0-9-]+/.+\\.md|\\.sfskills/runs/[A-Za-z0-9._-]+/report\\.md|\\.sfskills/builds/[a-z0-9]+(?:-[a-z0-9]+)*/envelopes/[A-Za-z0-9._-]+/.+\\.md)$",
      "description": "Markdown report path. Canonical: docs/reports/<agent-id>/<run_id>.md. Product Cursor runs may persist under .sfskills/runs/<run_id>/report.md. Build-layer runs (standards/build-orchestration.md \u00a7 2) persist under .sfskills/builds/<build-id>/envelopes/<step-or-stage>/<run_id>.md."
    },
    "envelope_path": {
      "type": "string",
      "pattern": "^(docs/reports/[a-z0-9-]+/.+\\.json|\\.sfskills/runs/[A-Za-z0-9._-]+/envelope\\.json|\\.sfskills/builds/[a-z0-9]+(?:-[a-z0-9]+)*/envelopes/[A-Za-z0-9._-]+/.+\\.json)$",
      "description": "JSON envelope path. Same stem as report_path, .json suffix, or product path envelope.json, or the build-layer path .sfskills/builds/<build-id>/envelopes/<step-or-stage>/<run_id>.json."
    },
    "input_fixture": {
      "type": "object",
      "description": "Wave 10: echo of the effective inputs used, after defaults applied. Sensitive values (tokens, passwords) MUST be redacted to the literal string '[REDACTED]'. Duplicates information in inputs_received; kept for back-compat.",
      "additionalProperties": true
    },
    "inputs_received": {
      "type": "object",
      "description": "Echo of the inputs the agent used, after defaults are applied. Sensitive values (credentials) MUST be redacted.",
      "additionalProperties": true
    },
    "summary": {
      "type": "string",
      "minLength": 20,
      "description": "One paragraph \u2014 the deliverable in a single screen."
    },
    "confidence": {
      "type": "string",
      "enum": [
        "HIGH",
        "MEDIUM",
        "LOW"
      ]
    },
    "outcome": {
      "type": "string",
      "enum": [
        "completed",
        "partial",
        "refused",
        "failed"
      ],
      "description": "Phase 1 product extension. Optional on legacy agents. Deployment Failure Triager MUST set this."
    },
    "confidence_rationale": {
      "type": "string",
      "description": "One-line reason for the score, keyed to the rubric in AGENT_CONTRACT.md."
    },
    "dimensions_compared": {
      "type": "array",
      "description": "Wave 8: agents that analyze a multi-dimensional surface (user-access-diff, org-drift-detector, etc.) MUST list which dimensions they successfully covered. Agents operating on a single surface MAY omit.",
      "items": {
        "type": "string"
      }
    },
    "dimensions_skipped": {
      "type": "array",
      "description": "Wave 8 / refined in Wave 10: dimensions the agent did not FULLY compare. Every non-fully-compared dimension MUST appear here \u2014 partial coverage (e.g. row count without detail) counts as not-full. If non-empty, confidence MUST be MEDIUM or LOW. Prevents the 'silently complete report' failure mode AND the 'count-only dimension drop' mode.",
      "items": {
        "type": "object",
        "required": [
          "dimension",
          "reason",
          "state"
        ],
        "additionalProperties": false,
        "properties": {
          "dimension": {
            "type": "string",
            "description": "The dimension name as it would appear in dimensions_compared."
          },
          "state": {
            "type": "string",
            "enum": [
              "count-only",
              "not-run",
              "partial"
            ],
            "description": "Wave 10: three-way classification. 'not-run' = dimension wasn't queried at all. 'count-only' = agent got a count/summary but not the detail needed for a diff. 'partial' = some sub-dimensions covered, others not. Prevents the Cursor-session pattern where SetupEntityAccess was summed but not detailed, yet the dimension appeared 'covered'."
          },
          "reason": {
            "type": "string",
            "minLength": 10,
            "description": "Why it was skipped. Must distinguish 'query returned zero rows' (skill-authoring concern) from 'query failed' (infrastructure concern) from 'feature not licensed'. Never collapse to 'not queryable in this org'."
          },
          "confidence_impact": {
            "type": "string",
            "enum": [
              "LOW",
              "MEDIUM",
              "NONE"
            ],
            "description": "How much this skip should pull the overall confidence down. LOW = dimension is load-bearing for the agent's purpose (skip \u2192 LOW confidence); MEDIUM = secondary (skip \u2192 at most MEDIUM); NONE = opt-in / cosmetic dimension."
          },
          "retry_hint": {
            "type": "string",
            "description": "What the caller could do to unblock this dimension \u2014 e.g. 'grant View Setup', 'enable Enterprise Territory Management', 'rerun with include_field_permissions=true'."
          }
        }
      }
    },
    "findings": {
      "type": "array",
      "description": "Structured deliverable findings. Optional \u2014 some agents emit pure documents via `deliverables[]` instead.",
      "items": {
        "type": "object",
        "required": [
          "id",
          "severity",
          "title"
        ],
        "properties": {
          "id": {
            "type": "string"
          },
          "severity": {
            "type": "string",
            "enum": [
              "P0",
              "P1",
              "P2",
              "INFO"
            ]
          },
          "title": {
            "type": "string"
          },
          "detail": {
            "type": "string"
          },
          "evidence": {
            "type": "object",
            "additionalProperties": true
          },
          "recommendation": {
            "type": "string"
          }
        }
      }
    },
    "deliverables": {
      "type": "array",
      "description": "Artifacts the agent produced (metadata XML stubs, markdown reports, proposed patches).",
      "items": {
        "type": "object",
        "required": [
          "kind",
          "title",
          "content"
        ],
        "properties": {
          "kind": {
            "type": "string",
            "enum": [
              "markdown",
              "xml",
              "apex",
              "lwc",
              "flow",
              "json",
              "yaml",
              "patch",
              "other"
            ]
          },
          "title": {
            "type": "string"
          },
          "target_path": {
            "type": "string",
            "description": "Where this deliverable is intended to land in the user's repo, if applicable."
          },
          "content": {
            "type": "string"
          }
        }
      }
    },
    "process_observations": {
      "type": "array",
      "description": "Structured Process Observations. Schema: schemas/observation.schema.json. Per AGENT_CONTRACT.md this block is REQUIRED; an empty array means the agent genuinely observed nothing beyond the deliverable.",
      "items": {
        "$ref": "urn:sfskills:observation"
      }
    },
    "refusal": {
      "type": "object",
      "description": "Set iff the agent stopped per an Escalation/Refusal rule. When set, all other deliverable fields MAY be absent.",
      "required": [
        "code",
        "message"
      ],
      "properties": {
        "code": {
          "type": "string",
          "description": "One of the codes in REFUSAL_CODES.md."
        },
        "message": {
          "type": "string"
        },
        "remediation_hint": {
          "type": "string"
        }
      }
    },
    "extensions": {
      "type": "object",
      "additionalProperties": true,
      "description": "Agent-specific structured payload that has no first-class field on this envelope \u2014 e.g. the requirements-clarifier's clarifications[] and capability_coverage[]. The envelope itself is additionalProperties: false, so anything an agent wants to carry beyond the contract goes here rather than at the top level. Keys are the agent's own; consumers MUST tolerate unknown ones."
    },
    "citations": {
      "type": "array",
      "description": "Every skill/template/standard/decision-tree branch/MCP tool/probe/agent/example_build consulted.",
      "items": {
        "$ref": "urn:sfskills:citation"
      }
    },
    "followups": {
      "type": "array",
      "description": "Recommended follow-up agents. Each entry references a real agents/<id>/.",
      "items": {
        "type": "object",
        "required": [
          "agent",
          "because"
        ],
        "properties": {
          "agent": {
            "type": "string",
            "pattern": "^[a-z0-9]+(?:-[a-z0-9]+)*$"
          },
          "because": {
            "type": "string",
            "minLength": 10
          }
        }
      }
    }
  }
}