{
  "agent": "build-doc-keeper",
  "mode": "single",
  "run_id": "2026-09-19T17-54-40Z",
  "report_path": ".sfskills/builds/northwind-sales/envelopes/M3-S04/2026-09-19T17-54-40Z.md",
  "envelope_path": ".sfskills/builds/northwind-sales/envelopes/M3-S04/2026-09-19T17-54-40Z.json",
  "inputs_received": {
    "build_dir": ".sfskills/builds/northwind-sales",
    "step_id": "M3-S04",
    "builder_envelope": "envelopes/M3-S04/2026-09-19T17-41-20Z.json",
    "results": "tests/M3-S04/results.json",
    "renderer": "scripts/render_step_docs.py"
  },
  "summary": "Documented M3-S04 by render_step_docs.py: 0 workbook rows in 02-page-layouts-and-lightning-pages.md, REQ-023 minted, 0 open items carried from the builder envelope(s) to decisions.md, operator D- entries appended. Set M3-S04 tested -> documented.",
  "confidence": "MEDIUM",
  "confidence_rationale": "Rows are derived, not narrated: every workbook row carries a real source_req_id and the verification the tester recorded; the traceability row joins artefact to test result. MEDIUM because the requirement sentence and any D- entries came from the operator, not from a re-read of the clarifications.",
  "outcome": "completed",
  "dimensions_compared": [
    "decisions-appended",
    "workbook-rows-written",
    "traceability-row-written"
  ],
  "dimensions_skipped": [],
  "process_observations": [
    {
      "category": "healthy",
      "severity": "info",
      "domain": "",
      "observation": "Renderer pass for M3-S04: deterministic rows from the builder envelope and results.json.",
      "evidence": {
        "source": "envelope",
        "path": "envelopes/M3-S04/2026-09-19T17-41-20Z.json"
      },
      "suggested_followup_agent": "step-tester",
      "followup_reason": "the next step in the chain, once built"
    }
  ],
  "citations": [
    {
      "type": "agent",
      "id": "build-doc-keeper",
      "path": "agents/build-doc-keeper/AGENT.md",
      "used_for": "the row schema, the append-only decisions rule, the traceability column set and the status transition this renderer reproduces"
    }
  ],
  "extensions": {
    "step_id": "M3-S04",
    "rows": [],
    "req": "REQ-023",
    "open_items_carried": 0
  },
  "followups": [
    {
      "agent": "step-tester",
      "because": "the next step in the chain, once built"
    }
  ]
}
