{
  "agent": "step-tester",
  "mode": "single",
  "run_id": "2026-09-12T07-51-46Z",
  "report_path": ".sfskills/builds/case-onboarding/envelopes/M4-S04/2026-09-12T07-51-46Z.md",
  "envelope_path": ".sfskills/builds/case-onboarding/envelopes/M4-S04/2026-09-12T07-51-46Z.json",
  "inputs_received": {
    "build_dir": ".sfskills/builds/case-onboarding",
    "step_id": "M4-S04"
  },
  "summary": "Ran the molecular tests for M4-S04 (Case escalation rules) after the F-36 rebuild: the declared build-scope checker check_escalation_rules.py exited 0 (W1 + 2x I2 + 2x I3, no ERROR), check-outputs reported ok, both XML files under artefacts/M4-S04 parsed, and the step's package.xml is consistent with its one EscalationRules:Case member. Both declared manual tests are Given/When/Then-shaped with a named observable outcome and are deferred to the milestone gate rather than counted as failures. Status set built -> tested.",
  "confidence": "HIGH",
  "outcome": "completed",
  "confidence_rationale": "Every declared test ran or was correctly classified as manual, both always-on checks completed, and every result came from an exit code or parse result this agent observed directly (Step 7 HIGH row).",
  "dimensions_compared": [
    "checker",
    "xml",
    "manifest",
    "manual-classification"
  ],
  "dimensions_skipped": [],
  "process_observations": [
    {
      "category": "healthy",
      "severity": "info",
      "observation": "The checker's post-rebuild exit shape (exit 0, W1 plus 2x I3) matches exactly what the plan's own test description and the prior builder/runner envelopes predicted, so this run confirms the rebuild rather than surprising it.",
      "domain": "automation-drift",
      "evidence": {
        "source": "repo_scan",
        "path": "tests/M4-S04/checker_stdout.txt"
      }
    },
    {
      "category": "healthy",
      "severity": "info",
      "observation": "Both declared manual acceptance tests are already written in Given/When/Then form with a named observable outcome (an escalation count, four specific field values), so neither had to be flagged unusable before being deferred to the milestone gate.",
      "domain": "acceptance-criteria-quality",
      "evidence": {
        "source": "input",
        "path": "plan.json steps[M4-S04].acceptance_tests[3-4]"
      }
    },
    {
      "category": "concerning",
      "severity": "high",
      "observation": "artefacts/M4-S04/deploy-order.md section 5 and both metadata-builder/build-step-runner envelopes for this rebuild carry an unresolved R2 finding: notifyCaseOwner now actually sends mail (since F-36 added notifyToTemplate) to whichever queue owns the case, and the Billing queue's address is a live Email-to-Case intake address. This test run's checker has no rule for that fact and cannot surface it as a failure; it is a human decision still owed at the M4 gate.",
      "domain": "email-routing-risk",
      "evidence": {
        "source": "repo_scan",
        "path": "artefacts/M4-S04/deploy-order.md"
      }
    },
    {
      "category": "ambiguous",
      "severity": "medium",
      "observation": "U6 (one escalation template, case_intake/Case_Escalated_To_Tier2, serving both notifyToTemplate and assignedToTemplate where the cited skill's worked example uses two distinct templates) is a plan-level judgment this test run cannot adjudicate; the checker's I4 does not fire because both references are folder-qualified, so nothing here flags it as a defect.",
      "domain": "requirements-completeness",
      "evidence": {
        "source": "repo_scan",
        "path": "artefacts/M4-S04/deploy-order.md"
      }
    },
    {
      "category": "suggested_followup",
      "severity": "low",
      "observation": "The step is now tested again after F-36, and its earlier tested record (2026-09-12T07-35-25Z) no longer describes the current artefact.",
      "domain": "build-orchestration",
      "evidence": {
        "source": "repo_scan",
        "path": "tests/M4-S04/results.json"
      },
      "suggested_followup_agent": "build-doc-keeper",
      "followup_reason": "Four decisions (the equal-480 reading, the confirmed R2 mail-loop exposure, the Q42 narrowing, and F-36 with its skill fix) still need decisions.md entries before the M4 gate."
    }
  ],
  "citations": [
    {
      "type": "standard",
      "id": "AGENT_RULES.md",
      "path": "AGENT_RULES.md",
      "used_for": "run-time rules binding this invocation, including the ban on org writes"
    },
    {
      "type": "standard",
      "id": "agents/_shared/AGENT_CONTRACT.md",
      "path": "agents/_shared/AGENT_CONTRACT.md",
      "used_for": "section shape, Process Observations block, confidence rubric this agent overrides"
    },
    {
      "type": "standard",
      "id": "agents/_shared/DELIVERABLE_CONTRACT.md",
      "path": "agents/_shared/DELIVERABLE_CONTRACT.md",
      "used_for": "persistence and atomic-write rule for the deliverable pair"
    },
    {
      "type": "standard",
      "id": "agents/_shared/REFUSAL_CODES.md",
      "path": "agents/_shared/REFUSAL_CODES.md",
      "used_for": "refusal enum (not triggered this run)"
    },
    {
      "type": "standard",
      "id": "standards/build-orchestration.md",
      "path": "standards/build-orchestration.md",
      "used_for": "section 5 acceptance-test types/runners/pass conditions, checker-scope rule, always-on manifest fail-not-skip rule for metadata step types"
    },
    {
      "type": "standard",
      "id": "agents/_shared/schemas/build-plan.schema.json",
      "path": "agents/_shared/schemas/build-plan.schema.json",
      "used_for": "shape of acceptance_tests[] and outputs[] read from the step"
    },
    {
      "type": "skill",
      "id": "devops/metadata-api-retrieve-deploy",
      "path": "skills/devops/metadata-api-retrieve-deploy/SKILL.md",
      "used_for": "package.xml grammar the manifest check is judged against"
    },
    {
      "type": "skill",
      "id": "devops/salesforce-dx-project-structure",
      "path": "skills/devops/salesforce-dx-project-structure/SKILL.md",
      "used_for": "filename-to-metadata-type mapping used to derive the EscalationRules:Case member from escalationRules/Case.escalationRules-meta.xml"
    },
    {
      "type": "skill",
      "id": "devops/metadata-api-coverage-gaps",
      "path": "skills/devops/metadata-api-coverage-gaps/SKILL.md",
      "used_for": "checking whether any component type here has no standalone file or manifest member (none did)"
    },
    {
      "type": "skill",
      "id": "admin/uat-and-acceptance-criteria",
      "path": "skills/admin/uat-and-acceptance-criteria/SKILL.md",
      "used_for": "what a manual test line must contain to be tickable at the milestone gate"
    },
    {
      "type": "skill",
      "id": "admin/acceptance-criteria-given-when-then",
      "path": "skills/admin/acceptance-criteria-given-when-then/SKILL.md",
      "used_for": "Given/When/Then shape check applied to both manual acceptance tests"
    },
    {
      "type": "skill",
      "id": "admin/escalation-rules",
      "path": "skills/admin/escalation-rules/SKILL.md",
      "used_for": "the declared checker this step's plan names; run verbatim, not re-derived"
    }
  ],
  "followups": [
    {
      "agent": "build-doc-keeper",
      "because": "The step is tested and four decisions (480 reading, R2 exposure, Q42 narrowing, F-36 skill fix) still need decisions.md entries before the M4 gate."
    }
  ],
  "extensions": {
    "step_id": "M4-S04",
    "results_path": ".sfskills/builds/case-onboarding/tests/M4-S04/results.json",
    "tests_run": 4,
    "results": [
      {
        "name": "python3 skills/admin/escalation-rules/scripts/check_escalation_rules.py --manifest-dir artefacts",
        "type": "checker",
        "runner": "declared checker command, run verbatim from the build directory (scope: build)",
        "exit_code": 0,
        "verdict": "pass",
        "detail": "WARN W1 (no rule active, expected under Q47) + 2x INFO I2 + 2x INFO I3 (480 minutes = 8h); no ERROR. check-outputs also ok: {\"ok\": true, \"missing\": [], \"empty\": [], \"malformed\": []}."
      },
      {
        "name": "xml",
        "type": "xml",
        "runner": "python3 xml.etree.ElementTree (stdlib)",
        "exit_code": null,
        "verdict": "pass",
        "detail": "2/2 files parsed: package.xml, escalationRules/Case.escalationRules-meta.xml"
      },
      {
        "name": "manifest",
        "type": "manifest",
        "runner": "step-tester manifest consistency check (step scope)",
        "exit_code": null,
        "verdict": "consistent",
        "detail": "EscalationRules:Case member present in package.xml; file exists for the member; no wildcard; no coverage-gap exclusions needed."
      }
    ],
    "failed": [],
    "skipped_manual": [
      "Given the rule ships inactive (Q47), when the sandbox proof is signed off, then a named owner activates it inside an agreed comparison window and records the first hour's escalation count. The checker's W1 finding ('no rule in this file is active') is the expected state here, not a defect.",
      "Given Q46 measures 8 business hours, when Case.escalationRules-meta.xml is read, then the Tier 2 entry's minutesToEscalation is 480 (8 x 60), not 8; its businessHoursSource is Case with no <businessHours> child; it reassigns to the queue developer name Tier_2_Engineering built in M2-S04; and the Severity 1 entry's businessHoursSource is None. check_business_hours_and_holidays.py is not declared on this step - at artefacts/M4-S04 it prints 'No BusinessHours settings file found' and exits 0 vacuously, because the calendars are M4-S01's artefacts; M4's milestone test runs it at --manifest-dir artefacts, which is where the 24/7 calendar assertion lives."
    ]
  }
}
